{
  "$schema": "https://json-schema.org/draft/2020-12/schema",
  "type": "object",
  "required": [
    "task_id",
    "objective",
    "context",
    "inputs",
    "authorized_scope",
    "available_tools",
    "acceptance_criteria"
  ],
  "properties": {
    "task_id": {
      "type": "string"
    },
    "objective": {
      "type": "string"
    },
    "context": {
      "type": "object"
    },
    "inputs": {
      "type": "object",
      "required": [
        "task",
        "acceptance_criteria",
        "herramientas",
        "riesgo",
        "budget",
        "autoridad"
      ],
      "properties": {
        "task": {
          "description": "task",
          "type": [
            "object",
            "array",
            "string",
            "number",
            "boolean",
            "null"
          ]
        },
        "acceptance_criteria": {
          "description": "acceptance criteria",
          "type": [
            "object",
            "array",
            "string",
            "number",
            "boolean",
            "null"
          ]
        },
        "herramientas": {
          "description": "herramientas",
          "type": [
            "object",
            "array",
            "string",
            "number",
            "boolean",
            "null"
          ]
        },
        "riesgo": {
          "description": "riesgo",
          "type": [
            "object",
            "array",
            "string",
            "number",
            "boolean",
            "null"
          ]
        },
        "budget": {
          "description": "budget",
          "type": [
            "object",
            "array",
            "string",
            "number",
            "boolean",
            "null"
          ]
        },
        "autoridad": {
          "description": "autoridad",
          "type": [
            "object",
            "array",
            "string",
            "number",
            "boolean",
            "null"
          ]
        }
      },
      "additionalProperties": true
    },
    "authorized_scope": {
      "type": "object"
    },
    "available_tools": {
      "type": "array",
      "items": {
        "type": "string"
      }
    },
    "acceptance_criteria": {
      "type": "array",
      "items": {
        "type": "string"
      }
    },
    "budget": {
      "type": "object"
    }
  },
  "additionalProperties": false
}